{
  "scp_id": "SCP-TEST",
  "title": "SCP-TEST",
  "scenes": [
    {
      "scene_num": 1,
      "act_id": "incident",
      "narration": "문이 닫히는 순간, 당신은 이미 늦었습니다. 플랫폼 끝에서 석상이 한 걸음 더 가까워져 있습니다.",
      "fact_tags": [{"key": "incident", "content": "Witnesses reported synchronized blink failures."}],
      "mood": "shock",
      "entity_visible": true,
      "location": "abandoned transit platform",
      "characters_present": ["SCP-TEST", "Observer-1"],
      "color_palette": "cold gray, alarm red, dirty white",
      "atmosphere": "suffocating panic under flickering lights"
    },
    {
      "scene_num": 2,
      "act_id": "incident",
      "narration": "축축한 콘크리트 냄새가 코를 찌릅니다. 당신이 숨을 고르는 사이 감시 화면 속 위치가 또 달라집니다.",
      "fact_tags": [{"key": "surveillance", "content": "Monitor review shows motion during blinks."}],
      "mood": "tense",
      "entity_visible": true,
      "location": "surveillance booth",
      "characters_present": ["SCP-TEST", "Observer-2"],
      "color_palette": "monitor green, cold steel, shadow black",
      "atmosphere": "nervous silence with electronic hum"
    },
    {
      "scene_num": 3,
      "act_id": "mystery",
      "narration": "재단은 왜 세 명을 붙여뒀을까요. 한 명이라도 눈을 감는 순간 계산이 무너진다는 뜻입니다.",
      "fact_tags": [{"key": "containment", "content": "Three observers are required."}],
      "mood": "mystery",
      "entity_visible": false,
      "location": "Site-19 control corridor",
      "characters_present": ["Observer-1", "Observer-2", "Observer-3"],
      "color_palette": "sterile white, muted blue",
      "atmosphere": "clinical dread hiding a bigger secret"
    },
    {
      "scene_num": 4,
      "act_id": "mystery",
      "narration": "근데 여기서 더 이상한 건 그림자입니다. 본체가 멈춘 뒤에도 검은 윤곽이 늦게 따라옵니다.",
      "fact_tags": [{"key": "shadow", "content": "Its shadow lingers after movement."}],
      "mood": "unease",
      "entity_visible": true,
      "location": "containment chamber threshold",
      "characters_present": ["SCP-TEST", "Observer-3"],
      "color_palette": "charcoal black, dim amber",
      "atmosphere": "lingering unease in stale air"
    },
    {
      "scene_num": 5,
      "act_id": "mystery",
      "narration": "만약 당신이 그 방에 들어간다면 가장 먼저 들리는 건 경보음이 아니라, 발뒤꿈치를 긁는 모래 소리일 겁니다.",
      "fact_tags": [{"key": "sensory", "content": "Witnesses reported grit sounds behind them."}],
      "mood": "immersive",
      "entity_visible": false,
      "location": "containment walkway",
      "characters_present": ["SCP-TEST", "D-9341"],
      "color_palette": "dusty gray, warning amber",
      "atmosphere": "tight suspense with creeping motion"
    },
    {
      "scene_num": 6,
      "act_id": "revelation",
      "narration": "이제 정체가 드러납니다. 이 개체는 감시가 끊기는 찰나를 먹고 움직이는, 재단 최악의 시야형 포식자였습니다.",
      "fact_tags": [{"key": "anomaly", "content": "It advances when every witness blinks."}],
      "mood": "revelation",
      "entity_visible": true,
      "location": "containment dossier montage",
      "characters_present": ["SCP-TEST"],
      "color_palette": "obsidian black, document beige, warning red",
      "atmosphere": "awful clarity replacing speculation"
    },
    {
      "scene_num": 7,
      "act_id": "revelation",
      "narration": "솔직히 이 부분은 자료만 봐도 소름 돋습니다. 셔터가 내려온 뒤에도 먼지 자국은 계속 앞으로 이어져 있었거든요.",
      "fact_tags": [{"key": "incident_log", "content": "Dust trail continued after shutters sealed."}],
      "mood": "horror",
      "entity_visible": true,
      "location": "sealed chamber floor",
      "characters_present": ["SCP-TEST"],
      "color_palette": "powder gray, blood red, blackout black",
      "atmosphere": "panic trapped inside a sealed room"
    },
    {
      "scene_num": 8,
      "act_id": "revelation",
      "narration": "게다가 재단은 아직도 이 그림자가 왜 남는지 모릅니다. 본체보다 늦게 도착하는 어둠, 그게 진짜 핵심일지도 모르죠.",
      "fact_tags": [{"key": "unknown", "content": "Foundation cannot explain the delayed shadow."}],
      "mood": "dread",
      "entity_visible": true,
      "location": "redacted report archive",
      "characters_present": ["SCP-TEST", "Archivist"],
      "color_palette": "faded paper, deep black, crimson stamp",
      "atmosphere": "scholarly fear with unanswered implications"
    },
    {
      "scene_num": 9,
      "act_id": "unresolved",
      "narration": "그래서 질문이 남습니다. 당신이 마지막 감시자라면, 눈이 타들어 가는 그 순간에도 끝까지 버틸 수 있을까요.",
      "fact_tags": [{"key": "question", "content": "Observers rotate before fatigue breaks line of sight."}],
      "mood": "questioning",
      "entity_visible": false,
      "location": "observation deck",
      "characters_present": ["Observer-1", "Observer-2", "Observer-3"],
      "color_palette": "cold blue, sleepless white",
      "atmosphere": "exhausted vigilance on the edge of failure"
    },
    {
      "scene_num": 10,
      "act_id": "unresolved",
      "narration": "문서는 끝났지만 이야기는 안 끝났습니다. 지금도 누군가는 그 석상을 보고 있고, 누군가는 깜빡임을 참지 못하고 있으니까요.",
      "fact_tags": [{"key": "ending", "content": "Containment remains ongoing."}],
      "mood": "lingering_unease",
      "entity_visible": true,
      "location": "Site-19 night watch station",
      "characters_present": ["SCP-TEST", "Night Watch Team"],
      "color_palette": "midnight blue, fluorescent white, concrete gray",
      "atmosphere": "unresolved dread that follows the viewer out"
    }
  ],
  "metadata": {
    "language": "ko",
    "scene_count": 10,
    "writer_model": "gpt-test-writer",
    "writer_provider": "openai",
    "prompt_template": "03_writing.md",
    "format_guide_template": "format_guide.md",
    "forbidden_terms_version": "sample-sha256"
  },
  "source_version": "v1-llm-writer"
}
